<parallel xmlns:xsi="http://www.w3.org/2001/XMLSchema-instance" xsi:noNamespaceSchemaLocation="parallel_texts.xsd">
    <text id="0">
        <sentence lang="cpb">ASHI OSARẼTSIPAITEKI</sentence>
        <sentence lang="pt">NO TEMPO DO VERÃO</sentence>
        <morphology format="" analysislevel=""/>
        <parsing format="" analysislevel=""/>
    </text>
    <text id="1">
        <sentence lang="cpb">ISAIKI ASHENĨKAPAINI
OTHAPIYAKIINI AMÕYANI OITA
AWAIRO NÃPITSI APIWTXA.</sentence>
        <sentence lang="pt">OS ASHANINKA DAQUI VIVEM NA BEIRINHA
DO BRASIL, ÀS MARGENS DO RIO AMÔNIA,
NUMA ALDEIA CHAMADA APIWTXA.</sentence>
        <morphology format="" analysislevel=""/>
        <parsing format="" analysislevel=""/>
    </text>
    <text id="2">
        <sentence lang="cpb">OSARẼTSI PAITEKI EẼTXERIKI
EERO IKIYAANAI ISHIKOIRAKI,
HATANAKI RANASHIWAITXA
ITSIPATXAARI ISHENĨKA PAINI,
IKOWIR IYOTERI.</sentence>
        <sentence lang="pt">NO TEMPO DO VERÃO AS CRIANÇAS
NÃO VÃO À ESCOLA. ANDAM COM SEUS
PARENTES PARA APRENDER COM ELES
AS COISAS QUE VÃO PRECISAR SABER
QUANDO CRESCEREM.</sentence>
        <morphology format="" analysislevel=""/>
        <parsing format="" analysislevel=""/>
    </text>
    <text id="3">
        <sentence lang="cpb">IYAATSI TAYRI ITXARINI, IKOWAKOTERI
        IYOTÃTXAAWORI RÃTERO TXEKOPI:
        EEROKA OTSIMATXE PIYOTERI PITOTERI ISHIWÃKI
        KAMETHA PIYOMATAKAIRO TXEKOPI. KAPIROKOTA
        EERO ITSIMÃTAWO TSIMERI. IKÃTSI IRIRORI.</sentence>
        <sentence lang="pt">TAYRI VAI VISITAR O SEU AVÔ PARA
        APRENDER A FAZER FLECHA:
        "VOCÊ TÊM QUE CORTAR AS PENAS IGUALZINHO.
        FLECHA COM PONTA DE TABOCA
        A CAÇA NÃO RESISTE!" - DIZ ELE.</sentence>
        <morphology format="" analysislevel=""/>
        <parsing format="" analysislevel=""/>
    </text>
    <text id="4">
        <sentence lang="cpb">IYAATATXE ITSIPATXARI IRẼTSI PIYÃKO
        EEHATSI IRITSIRO BIANCA, ROYAATANAKIRI
        RAKATXAATE IKÕKIRI WEWITO.
        HO! PAMINERITXA ETSĨYAKI, IKOWAKI
        IYAATE EEHATSI IRIRORI!</sentence>
        <sentence lang="pt">ELE VAI PARTIR COM SEUS IRMÃOS,
        PIANKO E BIANCA, E SEU TIO WEWITO,
        PARA UMA PESCARIA.
        EI! PARACE QUE ETSIYAKI, O CACHORRO,
        TAMBÉM QUER IR!</sentence>
        <morphology format="" analysislevel=""/>
        <parsing format="" analysislevel=""/>
    </text>
    <text id="5">
        <sentence lang="cpb">AREETAPAKIYA HÃTA, OTSIMATXE ÃTAPAAKI
        APÃKOSHI AMÃTXAARI, EẼTAATSI TAYRI
        EEHATSI PIYÃKO RAMITAKOTSIRI IKÕKIRI
        IRIRORI, IROORI BIANCA ÃTATSI
        IPÃKOSHI OTXAPANITE.</sentence>
        <sentence lang="pt">CHEGANDO LÁ É PRECISO CONSTRUIR
        UMA CABANA PARA PASSAR A NOITE.
        ENQUANTO TAYRI E PIANKO AJUDAM
        SEU TIO BIANCA FAZ COM SUAS PRIMAS
        UMA CABANA PARA O PINTINHO.</sentence>
        <morphology format="" analysislevel=""/>
        <parsing format="" analysislevel=""/>
    </text>
    <text id="6">
        <sentence lang="cpb">IKITEESHITAKOMANAI, TAYRI
        ANANIKAKI IYOTAIRO IRITSIRO HĨPE
        IKÃTAITSIRO, OOSHERO PAÃPARI
        OTSIMATXE AMINERO KAMETHA.
        PISHAYE KANIRI ANANTXA, IRIRORI
        SHIRÃPARI PAINIRÃTE IYẼTAAMẼTO:
        IRÕYAKA OITEESHIRITE OMANAATE!</sentence>
        <sentence lang="pt">NO DIA SEGUINTE BEM CEDO TAYRI
        ENSINA OS IRMÃOS:
        "PARA O FOGO PEGAR É PRECISO
        FAZER COM CARINHO..."
        ANANTXA DESCASCA A MACAXEIRA E OS
        MENINOS PREPARAM SEUS ARPÕES:
        É DIA DE PESCARIA!</sentence>
        <morphology format="" analysislevel=""/>
        <parsing format="" analysislevel=""/>
    </text>
    <text id="7">
        <sentence lang="cpb">HĨYAAKI ĨTHOMOITA ARI ISAIKI
        OIRÕTSI, ATSIKAWETAKARI IKIRIKI,
        KÃTSIMAITXA RAAKIRI EẼTXERIKI
        ITSITOKAIYAKIRINI.</sentence>
        <sentence lang="pt">NO FUNDO DO RIO UM CARANGUEJO
        QUASE LHES BELISCA O NARIZ, MAS
        OS MENINOS CONSEGUEM APANHÁ-LO.</sentence>
        <morphology format="" analysislevel=""/>
        <parsing format="" analysislevel=""/>
    </text>
    <text id="">
        <sentence lang="cpb">HĨPE IKAATSIKA PAAKARI
SHIMA? ARI IKAATSI APITE?
PIKÃTERI WEWITO ARIRIKA
PIMÕKAATAKA, TEKAATSIMA PIINA.
- IKÃTSI TAYRI.</sentence>
        <sentence lang="pt">- "QUANTOS PEIXES VOCÊ PESCOU?"
SÓ DOIS” – PERGUNTA TIO WEWITO
“AH JÁ DÁ PRA VOCÊ COMER”.
-“DÁ SIM, VOCÊ NÃO TEM MULHER”.
-COMPLETA TAYRI</sentence>
        <morphology format="ashaninkamorph" analysislevel="not-fully">
            

hĩpe	[=hĩpe][IndfSpecifCPB][=where; who]

kaatsika	[=kara~kaa][VRoot:CPB][=COP.CAP (EN: the.amount,, to.be.Nº/#.in.number/quantity_of_sth.)][--][&lt;*-ts][+EP]ts[--][-e~i+fut.+RSS@00000][MODALITY][+IRR]i[--][=ka][+Q]

paakari	[p-][VPers][2S/A+][--][=a][VRoot][=to.get][--][-ak][ASP][+PRF]ak[--][-a][+REAL]a[--][=ri][+3m.O]

shima	[=shima+m.+poss@ni.][NRoot][=fish; fish.sp., boquichico-fish (ES: boquichico, chupadora; sci.nm.: prochilodus.nigricans)]

?	?[$.]

ari	[=ari][PostPol][=PP][=there; so; thus; thereby; just.like.that (ES: así.es); to.be.this.way (ES: ser.así)]

ikaatsi	[i-][VPers][3m.S/A+][--][=kara~kaa][VRoot:CPB][=COP.CAP (EN: the.amount,, to.be.Nº/#.in.number/quantity_of_sth.)][--][&lt;*-ts][+EP]ts[--][-e~i+fut.+RSS@00000][MODALITY][+IRR]i

apite	[=apite][NumeralPRQ][=two]

?	?[$.]

pikãteri	[pi-][VPers][2S/A+][--][=kãt][VRoot][=to.say; to.call;; to.do; to.happen;; to.be (ES: ser); to.be.able][--][-e][+REAL]e[--][=ri][+3m.O]

wewito	[=vevito][NRoot][=person's.name]

aririka	[=ari][PostPol][=PP][--][=rika][+COND]::[=when (temporal.simultaneity), if (expresses.possible.condition)]

pimõkaataka	[pi-][VPers][2S/A+][--][=monkaa][VRoot][=to.measure; to.fulfill][--][-t][+EP]t[--][-ak][ASP][+PRF]ak[--][-a][+REAL]a

,	,[$.]

tekaatsima	[=tekaatsi][NRoot][=none, empty, zero, null][--][-ma][+DUB]

piina	[p-][NPers][2poss+][--][=iina+n.m.+inal@tsi.][NRoot][=mother; wife (kin.of.a.fe/male)]

.	.[$.]

-	-[$.]

ikãtsi	[i-][VPers][3m.S/A+][--][=kant][VRoot][=to.say; to.call;; to.do; to.happen;; to.be (ES: ser); to.be.able][--][-i][+REAL]i

tayri	[=tairi+n.m.][NRoot][=yellow-flowered.tree.sp. (ES: oropel; sci.nm.: erithrina.uley?)]

.	.[$.]

</morphology>
        <parsing format="" analysislevel=""/>
    </text>
</parallel>
