<!-- 

@book{suarez:historias:04,
author={Su\'{a}rez Sebasti\'{a}n, Amanda and Pilares Casas, Guido and Vargas, Lita},
title={Historias Ash\'{a}ninkas para estar despiertos contadas e ilustradas por ni\~{n}as y ni\~{n}os de San Miguel de Marankiari, La Merced, Junin},
year={2004},
}

historiasashaninkas_free.pdf

-->
<parallel xmlns:xsi="http://www.w3.org/2001/XMLSchema-instance" xsi:noNamespaceSchemaLocation="parallel_texts.xsd">
    <text id="2.0">
        <sentence lang="prq">INCHATO TSOMONTE</sentence>
        <sentence lang="es">EL ARBOL BARRIGÓN</sentence>
        <morphology format="" analysislevel=""/>
        <parsing format="" analysislevel=""/>
    </text>
    <text id="2.1">
        <sentence lang="prq">Inchatotsomonte irointi antaro timatsiri ojempeki isaikantari kamintsi.</sentence>
        <sentence lang="es">El árbol barrigón es un árbol tremendo pues, tiene su ramas, tiene su duende.</sentence>
        <morphology format="" analysislevel=""/>
        <parsing format="" analysislevel=""/>
    </text>
    <text id="2.2">
        <sentence lang="prq">Iro kantaincha te inkisajia kamintsi yanitapininti anta tomirimashiki, irocha eiro akempejitari, arika okompitakiami inchatotsomonte “¿Ari inkonijatitimotakemi maranke?”. Inkarate 10 antarotsa, arika, onkisakia inchatotsomonte ari inkonijatake irijaniki atiri meeka ontimatiye aya eirorika pobatsi ari inkajemakemi kamintsi, inkajemakemi irosati pikishotantanakia eiro panitajitsi ari pisabike irosati yobantakiami.</sentence>
        <sentence lang="es">Los árboles que tenemos aquí tienen su duende pero ya están amansados.
Allá en el monte, no te puedes acercar. Te aparece culebras, de 10 metros, que te comienza a rugir. Si estás solo, también se te aparece un ser, chiquitito nomás, un ser humano. Entonces te tienes que replegar porque si no te repliegas te comienza a llamar y te hipnotiza. Entonces te quedas allí nomás, te quedas para siempre y allí te recoge.</sentence>
        <morphology format="" analysislevel=""/>
        <parsing format="" analysislevel=""/>
    </text>
</parallel>
