<parallel xmlns:xsi="http://www.w3.org/2001/XMLSchema-instance" xsi:noNamespaceSchemaLocation="parallel_texts.xsd">
    <!-- 
    
a   ã
e   ẽ
i   ĩ
o   õ


A   Ã
E   Ẽ
I   Ĩ
O   Õ

    
(Este hombre tenía otra casa que estaba un poco lejos en un cerro. Para llegar allí el había hecho un puente de un palo
para cruzar el precipicio, Siempre cruzaba por allí,)

(Tema irica ashéninca ari osaiquiya ipancopero intatsiqueronta. 

Ari itovirori quetziroini antaro jirivatziqui cameetha opavitapaaca
tsica impeetatzi, ari opareencaatzi ñaa otaapiqui. Ariya
iquenapiintzi ashéninca ipampyaatzi iriyaatantyaari pashinequi ipanco.)
    
    
    -->
    <text id="0">
        <sentence lang="cpb">Iyotãtawori Sokãri Ashaninka</sentence>
        <sentence lang="pt">nascimento do Sokãri</sentence>
        <morphology format="ashaninkamorph" analysislevel="not-fully">


iyotãtawori	[=iyot][VRoot][=to.know (ES: saber); to.understand (ES: entender)][--][-anta][Asp][+APPL.REAS][=in.order.to]anta[--][-vo+n.m.][NS][+NMZ]vo[--][-ri+m.][NS][+NMZ]

sõkari	[=sõkari+n.m.+voc.][NRoot][=panpipe(s) (flute-like.instr.; ES: antara; PT: flauta); Ashéninka.flute]

ashaninka	[a-][NPers][1PL.poss+][--][=shani][VRoot][=to.be.of.the.same.group][--][-nka][NS][+NMZ.QLTY]nka

</morphology>
        <parsing/>
    </text>
    <text id="1">
        <sentence lang="cpb">Ikãta pairane Ashaninka iyotãtawori .,</sentence>
        <sentence lang="pt">Conta a história de como antigamente os Ashaninka aprenderam a tocar Sõkari.</sentence>
        <morphology format="ashaninkamorph" analysislevel="not-fully">


ikãta	[i-][VPers][3m.S/A+][--][=kãt][VRoot][=to.say; to.call;; to.do; to.happen;; to.be (ES: ser); to.be.able][--][-a][+REAL]a

pairane	[=pairane][AdvRoot][=since; before; long.ago]

ashaninka	[a-][NPers][1PL.poss+][--][=shani][VRoot][=to.be.of.the.same.group][--][-nka][NS][+NMZ.QLTY]nka

iyotãtawori	[=iyot][VRoot][=to.know (ES: saber); to.understand (ES: entender)][--][-ant][Asp][+APPL.REAS][=in.order.to, so.that]ant[--][-a][+REAL.RFL]a[--][=vo][+3n.m.O][--][=ri][NS][+REL]

,	,[$.]

</morphology>
        <parsing format="" analysislevel=""/>
    </text>
    <text id="2">
        <sentence lang="cpb">oya-atxawo oimi. Ketsiroini ikamake, itsitokaitakiri. Itsitokakéri owayiri,</sentence>
        <sentence lang="pt">A mulher foi em busca de seu marido desaparecido, morto pelos guerreiros. </sentence>
        <morphology format="ashaninkamorph" analysislevel="not-fully">


???

oimi	[o-][NPers][3n.m.poss+][--][=imi+m.+voc.][NRoot][=husband (kin.of.a.female; ES: esposo)]

.	.[$.]

ketsiroini	[=ketsiroini][AdvRoot][=sth.from.the.beginning, first(ly) (ES: primario, originario,, primeramente)]

ikamake	[i-][VPers][3m.S/A+][--][=kam][VRoot][=to.die][--][-ak][ASP][+PRF]ak[--][-e][+IRR]e

,	,[$.]

itsitokaitakiri	[i-][VPers][3m.S/A+][--][=tsitok][VRoot][=to.crush.sth. (ES: chancar); to.kill (ES: matar)][--][-a][+EP]a[--][-it][Asp][+ANT][=past/non-past.action:before]it[--][-ak][ASP][+PRF]ak[--][-i][+IRR]i[--][=ri][+3m.O]

.	.[$.]

itsitokakéri	[i-][VPers][3m.S/A+][--][=tsitok][VRoot][=to.crush.sth. (ES: chancar); to.kill (ES: matar)][--][-ak][ASP][+PRF]ak[--][-e][+IRR]e[--][=ri][+3m.O]

owayiri	[=ovayiri+m.][NRoot][=guerrilla; warrior (ES: guerrero); murderer]

,	,[$.]

</morphology>
        <parsing format="" analysislevel=""/>
    </text>
    <text id="3">
        <sentence lang="cpb">okãta iina osaykanake otsipatari mawa entsite.</sentence>
        <sentence lang="pt">Ela se sentiu só, com seus dois filhos,</sentence>
        <morphology format="ashaninkamorph" analysislevel="not-fully">


okãta	[=okanta][ConnRoot][=so.that]

iina	[i-][NPers][3m.poss+][--][=ina+n.m.+inal@tsi.+voc.][NRoot][=mother; wife (kin.of.a.fe/male)]

osaykanake	[o-][VPers][3n.m.S/A+][--][=saik][VRoot][=to.be, to.be.at, to.be.in; to.sit; to.live][--][-an+source][ADV][+DIR][=(upon).leaving/departing;INCH:beginning.of.a.new.state;INCEP:beginning.of.a.new.action]an[--][-ak][ASP][+PRF]ak[--][-e][+IRR]e

otsipatari	[o-][VPers][3n.m.S/A+][--][=tsipat][VRoot][=to.accompany; to.join; to.combine (ES: combinar)][--][-a][+IRR]a[--][=ri][+3m.O]

mawa	[=mava][NumeralPRQ][=three]

entsite	[=entsi+n./m.+poss@te.][NRoot][=child (ES: niño)][--][-i^te][+CL:anim.PL][=animate,plural]te

.	.[$.]

</morphology>
        <parsing format="" analysislevel=""/>
    </text>
    <text id="4">
        <sentence lang="cpb">Irohatsita paata ôya-atawori oimi, etakotawo enyiir owashiriwayta apaniroyni. Iroha-ããtanakawori henoke: ipeyari oowiro.</sentence>
        <sentence lang="pt">e ficou pensando num jeito de ir em busca do marido. Foi quando apareceu um ser muito poderoso, dos tempos passados, e encontrou a mulher muito triste e sozinha em seu desespêro. Então, esse ser antigo se transformou em Oowiro (gavião muito grande),</sentence>
        <morphology format="" analysislevel=""/>
        <parsing format="" analysislevel=""/>
    </text>
    <text id="5">
        <sentence lang="cpb">Irohatsita oyatakariri Pitsitsiro,</sentence>
        <sentence lang="pt">e ela foi levada em suas asas até seu marido. Lá no alto, ela encontrou Pitsitsiro (outro mundo das pessoas que passam pela Terra) e também seu marido.</sentence>
        <morphology/>
    </text>
    <text id="6">
        <sentence lang="cpb">iyotakero piratãtsi, Sõkari eehatsi tãpo.</sentence>
        <sentence lang="pt">Lá ensinaram a ela o Pirãtãtsi (músicas que fazem lembrar o passado e trazem alegrias e tristezas) e a tocar o sõkari (flauta) e o tãpo (tambor).</sentence>
        <morphology format="ashaninkamorph" analysislevel="not-fully">


iyotakero	[=iyotak][VRoot][=to.teach (ES: enseñar)][--][-e][+REAL]e[--][=ro][+3n.m.O]

???

,	,[$.]

sõkari	[=sõkari+n.m.+voc.][NRoot][=panpipe(s) (flute-like.instr.; ES: antara; PT: flauta); Ashéninka.flute]

eehatsi	[=eehatsi][ConnRoot][=also; and (PT: e)]

tãpo	[=tãpo/tambor][NRootEs][=tambor]



</morphology>
        <parsing format="" analysislevel=""/>
    </text>
    <text id="7">
        <sentence lang="cpb">Are okãta pairane kenkitharentsi. Professor Komãyari Ashaninka do Rio Amônea - Comunidade Apiwtxa</sentence>
        <sentence lang=""/>
        <morphology format="" analysislevel=""/>
        <parsing format="" analysislevel=""/>
    </text>
    <text id="8">
        <sentence lang="cpb">

Oimoshirinkikari Iwathaki Irirori

Irirori sherepiyari iyniiri osheki inintane,
aririka iranay iyamãpite. Iyeneri Itxokitsite
Ikemita inpokiromay, Thonkiri, Txoma, Txowãtsi,
eehatsi, kasheekari. Mawoyni sherepiyari ãtawiyare
tsimatsi inintane, iitarika ikowori irirori inintakoteri.

Professor Komãyari Ashaninka do Rio Amônea - Comunidade Apiwtxa
</sentence>
        <sentence lang="pt">

Protetor da matéria e dos espíritos

Ele, Sheripiyari (pajé), consegue ver muitas coisas boas através da música 
que traz as visões mostrando plantas medicinais e os caminhos do mal e do bem.
Quando bebe Kamarãpe (Ayuaska), vê o impokiromai (estrela que tem mistérios
e orienta o pajé), o Thõkiri (beija-flor), o Thowa (japó, pássaro-guia do pajé) e o 
Kashekari (onça com a qual caminha o espírito do pajé), buscando conhecimiento 
e cuidando de sua família, protegendo-a do mal. Todos os Sheripiyari e Ãtawiyari (pajé
iniciante) têm seu protetor. O que ele quiser 
fazer, ele consegue. Faz para ajudar nas curas das doenças e outras coisas mais.
</sentence>
        <morphology format="" analysislevel=""/>
        <parsing format="" analysislevel=""/>
    </text>
    <text id="">
        <sentence lang="cpb">Ashi osarẽtsipaiteki</sentence>
        <sentence lang="pt">No Tempo do Verão</sentence>
        <morphology format="ashaninkamorph" analysislevel="not-fully">


ashi	[=ashi][PrnPoss][+3SG.n.m.][=her, hers, its (ES: suyo.(de.mujer)]

osarẽtsipaiteki	[=osarentsi+m.+poss@te.][NRoot][=year (ES: año); dry.season/summer (ES: verano)][--][-paite][+ADV][=during, at.the.time.of.sth., period][--][-ki][Cas][+LOC_LOC.T]

</morphology>
        <parsing format="" analysislevel=""/>
    </text>
    <text id="">
        <sentence lang="cpb">Sãkinate 5 owayro (lixo) amashitsirori kipatsi  </sentence>
        <sentence lang=""/>
        <morphology format="ashaninkamorph" analysislevel="not-fully">


owayro	[o-][NPers][3n.m.poss+][--][=vairo+n.m.+inal@ntsi.][NRoot][=name (ES: nombre)]

amashitsirori	[=amashi][VRoot][=to.wound; to.destroy (ES: malograr)][--][-ts][+EP]ts[--][-i][+IRR]i[--][=ro][+3n.m.O][--][=ri][NS][+REL]

</morphology>
        <parsing format="" analysislevel=""/>
    </text>
</parallel>
