<!-- 

@article{apiwtxa:gestao:07,
author={Associa\c{c}\~{a}o, Apiwtxa},
title={Plano de gest\~{a}o territorial e ambiental da terra ind\'{i}gena Kampa do rio Am\^{o}nia},
year={2007},
}

a   ã
e   ẽ
i   ĩ
o   õ

A   Ã
E   Ẽ
I   Ĩ
O   Õ

-->
<parallel xmlns:xsi="http://www.w3.org/2001/XMLSchema-instance" xsi:noNamespaceSchemaLocation="parallel_texts.xsd">
    <text id="0">
        <!-- AYAWÕTATSIRO HIYATENE AASHI IPATSITE ASHENIKA AMOYSATSI -->
        <sentence lang="cpb">AYAWÕTATSIRO HIYATENE AASHI IPATSITE ASHENĨKA AMOYSATSI</sentence>
        <sentence lang="pt">TERRA INDÍGENA KAMPA DO RIO AMÔNIA</sentence>
    </text>
    <text id="1">
        <sentence lang="cpb">ASHE AMINÃTXARI AIPATSITE ASHANINKA EERO ITHÕKATXARI ASHE. AAKA SEYKAYETSIRI ÃTAMIKI EEHATISITA AASHE WIRAKOTXA SEYKAYETSIRI OKOWAKINE AIPATSITE</sentence>
        <sentence lang="pt">PLANO DE GESTÃO TERRITORIAL E AMBIENTAL DA TERRA INDÍGENA KAMPA DO RIO AMÔNIA</sentence>
        <morphology format="" analysislevel=""/>
        <parsing format="" analysislevel=""/>
    </text>
    <text id="2">
        <sentence lang="cpb">I –SEYKAYETSIRI ÃTAMIKI</sentence>
        <sentence lang="pt">I – RECURSOS FLORESTAIS E FLORÍSTICOS</sentence>
        <morphology format="" analysislevel=""/>
        <parsing format="" analysislevel=""/>
    </text>
    <text id="3">
        <sentence lang="cpb">1 - Tsiirotsiiki:</sentence>
        <sentence lang="pt">1 - Murmuru:</sentence>
        <morphology format="" analysislevel=""/>
        <parsing format="" analysislevel=""/>
    </text>
    <text id="4">
        <sentence lang="cpb">Akoyiteri tsiirotsiiki ashi opimãtxaa: apaa akoyiteri seikatsiri othapiyaki hiyatene eehatsii ãtawa, okakini anãpi awotsiki.</sentence>
        <sentence lang="pt">A coleta para a venda deve usar os indivíduos localizados nas margens dos rios e nos caminhos próximos das casas de moradias.</sentence>
        <morphology format="" analysislevel=""/>
        <parsing format="" analysislevel=""/>
    </text>
    <text id="5">
        <sentence lang="cpb">Aririka akoyiteri tsiirotsiiki othapiyaki hiyatene, ãtawaki eero athõkiri mawoyni otsiimatxe ookere apawopayni ashi royari tsimeri-payni.</sentence>
        <sentence lang="pt">Quando fizer a coleta nas margens dos rios, procurar deixar sempre alguns murmurus para as caças se alimentarem.</sentence>
        <morphology format="" analysislevel=""/>
        <parsing format="" analysislevel=""/>
    </text>
</parallel>
