<parallel xmlns:xsi="http://www.w3.org/2001/XMLSchema-instance" xsi:noNamespaceSchemaLocation="parallel_texts.xsd">
    <text id="1.0">
        <sentence lang="prq">IKANTAKOTA  ITSIMANTAKARI  NAVIRIRI</sentence>
        <sentence lang="es">HISTORIA  NACIMIENTO DEL HOMBRE TRANSFORMADOR</sentence>
        <morphology format="" analysislevel=""/>
        <parsing format="" analysislevel=""/>
    </text>
    <text id="1.1">
        <sentence lang="prq">Iroñaaka  itsimantakari iyora naviriri, tsimatsi aparoni shirampari pairani.</sentence>
        <sentence lang="es">Ahora,  para que acontezca el nacimiento del transformador  o convertidor de personas, había un hombre paisano antes.</sentence>
        <morphology format="" analysislevel=""/>
        <parsing format="" analysislevel=""/>
    </text>
</parallel>
